No.     Time        Source            Destination         Protocol       Info
  1 0.000000    192.168.1.1           192.168.1.2           TCP     4083 > http [SYN] Seq=0 Win=5840 Len=0 MSS=1460 TSV=4294963568 TSER=0 WS=1
  2 0.000343    192.168.1.2           192.168.1.1           TCP     http > 4083 [SYN, ACK] Seq=0 Ack=1 Win=5792 Len=0 MSS=1460 TSV=4294963407 TSER=4294963568 WS=1
  3 0.000287    192.168.1.1           192.168.1.2           TCP     4083 > http [ACK] Seq=1 Ack=1 Win=5840 Len=0 TSV=4294963568 TSER=4294963407
  4 0.020884    192.168.1.1           192.168.1.2           HTTP    GET / HTTP/1.0
  5 0.020911    192.168.1.2           192.168.1.1           TCP     http > 4083 [ACK] Seq=1 Ack=216 Win=6864 Len=0 TSV=4294963410 TSER=4294963570
  6 0.068318    192.168.1.2           192.168.1.1           HTTP    HTTP/1.1 200 OK (text/html)
  7 0.068594    192.168.1.1           192.168.1.2           TCP     4083 > http [ACK] Seq=216 Ack=297 Win=6912 Len=0 TSV=4294963574 TSER=4294963413
  8 0.069314    192.168.1.2           192.168.1.1           TCP     http > 4083 [FIN, ACK] Seq=297 Ack=216 Win=6864 Len=0 TSV=4294963413 TSER=4294963574
  9 0.113180    192.168.1.1           192.168.1.2           TCP     4083 > http [ACK] Seq=216 Ack=298 Win=6912 Len=0 TSV=4294963578 TSER=4294963413
 10 0.113182    192.168.1.1           192.168.1.2           TCP     4083 > http [FIN, ACK] Seq=216 Ack=298 Win=6912 Len=0 TSV=4294963579 TSER=4294963413
 11 0.113213    192.168.1.2           192.168.1.1           TCP     http > 4083 [ACK] Seq=298 Ack=217 Win=6864 Len=0 TSV=4294963418 TSER=4294963579